Mirae Asset Large Cap Fund - Direct Plan,15.52,48/78,18.65,29/57,13.89,5/42,--,--,--,--
Mirae Asset Large & Midcap Fund - Direct Plan,18.52,27/32,23.21,19/25,17.96,1/18,--,--,--,--
Mirae Asset Midcap Fund - Direct Plan,21.96,24/32,29.65,10/25,--,--,--,--,--,--
Mirae Asset Multicap Fund - Direct Plan,--,--,--,--,--,--,--,--,--,--
Mirae Asset Nifty 100 ESG Sector Leaders ETF,14.79,6/10,--,--,--,--,--,--,--,--
Mirae Asset Nifty 100 ESG Sector Leaders FoF - Direct Plan,14.73,9/9,--,--,--,--,--,--,--,--
Mirae Asset Nifty 100 Low Volatility 30 ETF,--,--,--,--,--,--,--,--,--,--
Mirae Asset Nifty 200 Alpha 30 ETF,--,--,--,--,--,--,--,--,--,--
Mirae Asset Nifty 200 Alpha 30 ETF FoF - Direct Plan,--,--,--,--,--,--,--,--,--,--
Mirae Asset Nifty500 Multicap 50:25:25 ETF,--,--,--,--,--,--,--,--,--,--
Mirae Asset Nifty50 Equal Weight ETF,--,--,--,--,--,--,--,--,--,--
Mirae Asset Nifty 50 ETF,15.55,60/121,18.61,37/97,--,--,--,--,--,--
Mirae Asset Nifty 50 Index Fund - Direct Plan,--,--,--,--,--,--,--,--,--,--
Mirae Asset Nifty Bank ETF,--,--,--,--,--,--,--,--,--,--
Mirae Asset Nifty EV and New Age Automotive ETF,--,--,--,--,--,--,--,--,--,--
Mirae Asset Nifty Financial Services ETF,17.73,15/31,--,--,--,--,--,--,--,--
Mirae Asset Nifty India Internet ETF,--,--,--,--,--,--,--,--,--,--
Mirae Asset Nifty India Manufacturing ETF,22.70,11/38,--,--,--,--,--,--,--,--
Mirae Asset Nifty India Manufacturing ETF FoF - Direct Plan,22.32,17/33,--,--,--,--,--,--,--,--
Mirae Asset Nifty India New Age Consumption ETF,--,--,--,--,--,--,--,--,--,--
Mirae Asset Nifty India New Age Consumption ETF FoF - Direct Plan,--,--,--,--,--,--,--,--,--,--
Mirae Asset Nifty IT ETF,--,--,--,--,--,--,--,--,--,--
Mirae Asset Nifty LargeMidcap 250 Index Fund - Direct Plan,--,--,--,--,--,--,--,--,--,--
Mirae Asset Nifty Metal ETF,--,--,--,--,--,--,--,--,--,--
Mirae Asset Nifty Midcap 150 ETF,25.68,8/39,--,--,--,--,--,--,--,--
Mirae Asset Nifty MidSmallcap400 Momentum Quality 100 ETF,--,--,--,--,--,--,--,--,--,--
Mirae Asset Nifty MidSmallcap400 Momentum Quality 100 ETF FoF - Direct Plan,--,--,--,--,--,--,--,--,--,--
Mirae Asset Nifty Next 50 ETF,19.24,14/121,20.95,17/97,--,--,--,--,--,--
Mirae Asset Nifty PSU Bank ETF,--,--,--,--,--,--,--,--,--,--
Mirae Asset Nifty Smallcap 250 Momentum Quality 100 ETF,--,--,--,--,--,--,--,--,--,--
Mirae Asset Nifty Smallcap 250 Momentum Quality 100 ETF FoF - Direct Plan,--,--,--,--,--,--,--,--,--,--
Mirae Asset Nifty Total Market Index Fund - Direct Plan,--,--,--,--,--,--,--,--,--,--
Mirae Asset NYSE FANG+ ETF,45.19,2/53,--,--,--,--,--,--,--,--
Mirae Asset NYSE FANG+ ETF FoF - Direct Plan,52.98,1/47,--,--,--,--,--,--,--,--
Mirae Asset Small Cap Fund - Direct Plan,--,--,--,--,--,--,--,--,--,--
Mirae Asset S&P 500 Top 50 ETF,24.73,12/53,--,--,--,--,--,--,--,--
Mirae Asset S&P 500 Top 50 ETF FoF - Direct Plan,28.50,4/47,--,--,--,--,--,--,--,--
Motilal Oswal Active Momentum Fund - Direct Plan,--,--,--,--,--,--,--,--,--,--
Motilal Oswal BSE 1000 Index Fund - Direct Plan,--,--,--,--,--,--,--,--,--,--
Motilal Oswal BSE Enhanced Value ETF,--,--,--,--,--,--,--,--,--,--
Motilal Oswal BSE Enhanced Value Index Fund - Direct Plan,--,--,--,--,--,--,--,--,--,--
Motilal Oswal BSE Financials ex Bank 30 Index Fund - Direct Plan,--,--,--,--,--,--,--,--,--,--
Motilal Oswal BSE Healthcare ETF,--,--,--,--,--,--,--,--,--,--
Motilal Oswal BSE India Infrastructure ETF,--,--,--,--,--,--,--,--,--,--
Motilal Oswal BSE Low Volatility ETF,17.13,30/36,--,--,--,--,--,--,--,--
Motilal Oswal BSE Low Volatility Index Fund - Direct Plan,16.72,32/32,--,--,--,--,--,--,--,--
Motilal Oswal BSE Quality ETF,--,--,--,--,--,--,--,--,--,--
Motilal Oswal BSE Quality Index Fund - Direct Plan,--,--,--,--,--,--,--,--,--,--
Motilal Oswal Business Cycle Fund - Direct Plan,--,--,--,--,--,--,--,--,--,--
Motilal Oswal Developed Market Ex US ETFs FoF - Direct Plan,--,--,--,--,--,--,--,--,--,--
Motilal Oswal Digital India Fund - Direct Plan,--,--,--,--,--,--,--,--,--,--
Motilal Oswal ELSS Tax Saver Fund - Direct Plan,29.73,1/33,27.91,2/33,17.91,2/26,--,--,--,--
Motilal Oswal Flexi Cap Fund - Direct Plan,26.09,4/68,20.43,31/54,13.81,21/35,--,--,--,--
Motilal Oswal Focused Fund - Direct Plan,13.42,64/68,15.33,53/54,11.44,33/35,--,--,--,--
Motilal Oswal Infrastructure Fund - Direct Plan,--,--,--,--,--,--,--,--,--,--
Motilal Oswal Innovation Opportunities Fund - Direct Plan,--,--,--,--,--,--,--,--,--,--
Motilal Oswal Large and Midcap Fund - Direct Plan,31.60,1/32,30.70,1/25,--,--,--,--,--,--
Motilal Oswal Large Cap Fund - Direct Plan,--,--,--,--,--,--,--,--,--,--
Motilal Oswal Manufacturing Fund - Direct Plan,--,--,--,--,--,--,--,--,--,--
Motilal Oswal Midcap Fund - Direct Plan,31.12,2/32,36.21,1/25,18.39,5/19,--,--,--,--
Motilal Oswal Multi Cap Fund - Direct Plan,--,--,--,--,--,--,--,--,--,--
Motilal Oswal NASDAQ 100 ETF,26.61,6/53,20.49,1/30,20.98,1/25,--,--,--,--
Motilal Oswal Nasdaq 100 FOF - Direct Plan,26.99,6/47,20.47,1/28,--,--,--,--,--,--
Motilal Oswal Nasdaq Q50 ETF,15.60,29/53,--,--,--,--,--,--,--,--
Motilal Oswal Nifty 200 Momentum 30 ETF,20.88,11/36,--,--,--,--,--,--,--,--
Motilal Oswal Nifty 200 Momentum 30 Index Fund - Direct Plan,20.96,16/32,--,--,--,--,--,--,--,--
Motilal Oswal Nifty 500 ETF,--,--,--,--,--,--,--,--,--,--
Motilal Oswal Nifty 500 Index Fund - Direct Plan,17.93,43/68,21.03,26/54,--,--,--,--,--,--
Motilal Oswal Nifty 500 Momentum 50 ETF,--,--,--,--,--,--,--,--,--,--
Motilal Oswal Nifty 500 Momentum 50 Index Fund - Direct Plan,--,--,--,--,--,--,--,--,--,--
Motilal Oswal Nifty 50 Equal Weight ETF,--,--,--,--,--,--,--,--,--,--
Motilal Oswal Nifty 50 ETF,15.54,64/121,18.56,47/97,12.11,27/60,--,--,--,--
Motilal Oswal Nifty 50 Index Fund - Direct Plan,15.40,49/78,18.37,33/57,--,--,--,--,--,--
Motilal Oswal Nifty Alpha 50 ETF,--,--,--,--,--,--,--,--,--,--
Motilal Oswal Nifty Bank Index Fund - Direct Plan,16.14,15/17,20.39,10/12,--,--,--,--,--,--
Motilal Oswal Nifty Capital Market ETF,--,--,--,--,--,--,--,--,--,--
Motilal Oswal Nifty Capital Market Index Fund - Direct Plan,--,--,--,--,--,--,--,--,--,--
Motilal Oswal Nifty India Defence ETF,--,--,--,--,--,--,--,--,--,--
Motilal Oswal Nifty India Defence Index Fund - Direct Plan,--,--,--,--,--,--,--,--,--,--
Motilal Oswal Nifty India Manufacturing ETF,--,--,--,--,--,--,--,--,--,--
Motilal Oswal Nifty India Tourism ETF,--,--,--,--,--,--,--,--,--,--
Motilal Oswal Nifty Microcap 250 Index Fund - Direct Plan,--,--,--,--,--,--,--,--,--,--
Motilal Oswal Nifty Midcap 100 ETF,26.44,6/39,30.64,5/29,15.97,7/20,--,--,--,--
Motilal Oswal Nifty Midcap 150 Index Fund - Direct Plan,25.52,12/32,29.88,9/25,--,--,--,--,--,--
Motilal Oswal Nifty Midcap150 Momentum 50 ETF,--,--,--,--,--,--,--,--,--,--
Motilal Oswal Nifty MidSmall Financial Services Index Fund - Direct Plan,--,--,--,--,--,--,--,--,--,--
Motilal Oswal Nifty MidSmall Healthcare Index Fund - Direct Plan,--,--,--,--,--,--,--,--,--,--
Motilal Oswal Nifty MidSmall India Consumption Index Fund - Direct Plan,--,--,--,--,--,--,--,--,--,--
Motilal Oswal Nifty MidSmall IT and Telecom Index Fund - Direct Plan,--,--,--,--,--,--,--,--,--,--
Motilal Oswal Nifty Next 50 ETF,--,--,--,--,--,--,--,--,--,--
Motilal Oswal Nifty Next 50 Index Fund - Direct Plan,19.17,8/78,20.72,15/57,--,--,--,--,--,--
Motilal Oswal Nifty PSE ETF,--,--,--,--,--,--,--,--,--,--
Motilal Oswal Nifty Realty ETF,--,--,--,--,--,--,--,--,--,--
Motilal Oswal Nifty Smallcap 250 ETF,--,--,--,--,--,--,--,--,--,--
Motilal Oswal Nifty Smallcap 250 Index Fund - Direct Plan,26.19,11/28,32.06,17/22,--,--,--,--,--,--
Motilal Oswal Quant Fund - Direct Plan,--,--,--,--,--,--,--,--,--,--
Motilal Oswal Services Fund - Direct Plan,--,--,--,--,--,--,--,--,--,--
Motilal Oswal Small Cap Fund - Direct Plan,--,--,--,--,--,--,--,--,--,--
Motilal Oswal S&P 500 Index Fund - Direct Plan,20.98,16/47,18.28,4/28,--,--,--,--,--,--
Motilal Oswal Special Opportunities Fund - Direct Plan,--,--,--,--,--,--,--,--,--,--
Navi BSE Sensex Index Fund - Direct Plan,--,--,--,--,--,--,--,--,--,--
Navi ELSS Tax Saver Fund - Direct Plan,16.28,--,18.84,--,--,--,--,--,--,--
Navi ELSS Tax Saver Nifty 50 Index Fund - Direct Plan,--,--,--,--,--,--,--,--,--,--
Navi Flexi Cap Fund - Direct Plan,16.66,55/68,20.30,34/54,--,--,--,--,--,--
Navi Large & Midcap Fund - Direct Plan,16.90,30/32,22.97,21/25,--,--,--,--,--,--
Navi Nifty 500 Multicap 50:25:25 Index Fund - Direct Plan,--,--,--,--,--,--,--,--,--,--
Navi Nifty 50 Index Fund - Direct Plan,15.39,50/78,--,--,--,--,--,--,--,--
Navi Nifty Bank Index Fund - Direct Plan,16.03,16/17,--,--,--,--,--,--,--,--
Navi Nifty India Manufacturing Index Fund - Direct Plan,--,--,--,--,--,--,--,--,--,--
Navi Nifty IT Index Fund - Direct Plan,--,--,--,--,--,--,--,--,--,--
Navi Nifty Midcap 150 Index Fund - Direct Plan,25.23,15/32,--,--,--,--,--,--,--,--
Navi Nifty Next 50 Index Fund - Direct Plan,19.11,12/78,--,--,--,--,--,--,--,--
Navi Nifty Smallcap250 Momentum Quality 100 Index Fund - Direct Plan,--,--,--,--,--,--,--,--,--,--
Navi US NASDAQ 100 FoF - Direct Plan,26.70,--,--,--,--,--,--,--,--,--
Navi US Total Stock Market FoF - Direct Plan,20.56,--,--,--,--,--,--,--,--,--
Nippon India Active Momentum Fund - Direct Plan,--,--,--,--,--,--,--,--,--,--
Nippon India Banking & Financial Services Fund - Direct Plan,21.97,5/17,26.82,1/12,14.08,6/10,--,--,--,--
Nippon India BSE Sensex Next 30 ETF,--,--,--,--,--,--,--,--,--,--
Nippon India BSE Sensex Next 30 Index Fund - Direct Plan,--,--,--,--,--,--,--,--,--,--
Nippon India Consumption Fund - Direct Plan,20.21,3/11,25.09,2/11,15.16,5/7,--,--,--,--
Nippon India Diversified Equity Flexicap Passive FoF - Direct Plan,17.69,47/68,--,--,--,--,--,--,--,--
Nippon India ELSS Tax Saver Fund - Direct Plan,20.46,14/33,24.47,11/33,11.40,26/26,--,--,--,--
Nippon India ETF BSE Sensex,14.84,92/121,17.70,71/97,12.51,13/60,--,--,--,--
Nippon India ETF BSE Sensex Next 50,21.73,5/121,25.13,5/97,--,--,--,--,--,--
Nippon India ETF Hang Seng BeES,13.40,35/53,5.84,25/30,5.57,22/25,8.01,4/11,--,--
Nippon India ETF Nifty 100,15.23,76/121,18.24,57/97,11.85,35/60,--,--,--,--
Nippon India ETF Nifty 50 BeES,15.56,57/121,18.61,38/97,12.49,17/60,11.87,15/44,13.87,9/29
Nippon India ETF Nifty 50 Shariah BeES,6.87,121/121,12.36,97/97,9.72,59/60,9.58,43/44,--,--
Nippon India ETF Nifty 50 Value 20,15.56,24/25,20.27,19/20,14.32,9/14,--,--,--,--
Nippon India ETF Nifty Bank BeES,16.18,21/31,20.62,13/21,11.95,10/15,12.56,4/8,14.59,2/3
Nippon India ETF Nifty Dividend Opportunities 50,20.26,22/38,21.96,14/20,13.79,3/11,--,--,--,--
Nippon India ETF Nifty India Consumption,17.13,9/15,19.60,10/12,13.35,7/8,--,--,--,--
Nippon India ETF Nifty Infrastructure BeES,23.31,16/20,23.26,20/20,10.76,20/20,--,--,--,--
Nippon India ETF Nifty IT,9.88,12/13,17.49,6/6,--,--,--,--,--,--
Nippon India ETF Nifty Midcap 150,25.54,12/39,30.16,7/29,--,--,--,--,--,--
Nippon India ETF Nifty Next 50 Junior BeES,19.27,13/121,21.16,16/97,13.24,4/60,13.00,6/44,14.45,5/29
Nippon India ETF Nifty PSU Bank BeES,36.39,2/31,37.64,1/21,7.95,13/15,4.69,7/8,--,--
Nippon India Flexi Cap Fund - Direct Plan,18.69,35/68,--,--,--,--,--,--,--,--
Nippon India Focused Fund - Direct Plan,17.21,51/68,23.90,13/54,14.26,16/35,--,--,--,--
Nippon India Growth Mid Cap Fund - Direct Plan,28.33,4/32,32.29,5/25,18.12,6/19,--,--,--,--
Nippon India Index Fund - BSE Sensex Plan - Direct Plan,14.61,71/78,17.49,52/57,12.15,29/42,--,--,--,--
Nippon India Index Fund - Nifty 50 Plan - Direct Plan,15.34,54/78,18.36,35/57,12.16,28/42,--,--,--,--
Nippon India Innovation Fund - Direct Plan,--,--,--,--,--,--,--,--,--,--
Nippon India Japan Equity Fund - Direct Plan,15.38,26/47,10.03,19/28,7.62,17/23,--,--,--,--
Nippon India Large Cap Fund - Direct Plan,22.39,2/78,25.65,2/57,14.73,1/42,--,--,--,--
Nippon India MNC Fund - Direct Plan,--,--,--,--,--,--,--,--,--,--
Nippon India Multi Cap Fund - Direct Plan,26.65,1/14,32.23,--,15.51,--,--,--,--,--
Nippon India Nifty 500 Equal Weight Index Fund - Direct Plan,--,--,--,--,--,--,--,--,--,--
Nippon India Nifty 500 Low Volatility 50 Index Fund - Direct Plan,--,--,--,--,--,--,--,--,--,--
Nippon India Nifty 500 Momentum 50 Index Fund - Direct Plan,--,--,--,--,--,--,--,--,--,--
Nippon India Nifty 500 Quality 50 Index Fund - Direct Plan,--,--,--,--,--,--,--,--,--,--
Nippon India Nifty 50 Value 20 Index Fund - Direct Plan,15.55,21/21,--,--,--,--,--,--,--,--
Nippon India Nifty Alpha Low Volatility 30 Index Fund - Direct Plan,--,--,--,--,--,--,--,--,--,--
Nippon India Nifty Auto ETF,24.79,6/38,--,--,--,--,--,--,--,--
Nippon India Nifty Auto Index Fund - Direct Plan,--,--,--,--,--,--,--,--,--,--
Nippon India Nifty Bank Index Fund - Direct Plan,--,--,--,--,--,--,--,--,--,--
Nippon India Nifty IT Index Fund - Direct Plan,--,--,--,--,--,--,--,--,--,--
Nippon India Nifty Midcap 150 Index Fund - Direct Plan,25.30,14/32,--,--,--,--,--,--,--,--
Nippon India Nifty Next 50 Junior BeES FoF - Direct Plan,19.19,7/78,21.02,8/57,--,--,--,--,--,--
Nippon India Nifty Pharma ETF,22.67,13/15,--,--,--,--,--,--,--,--
Nippon India Nifty Realty Index Fund - Direct Plan,--,--,--,--,--,--,--,--,--,--
Nippon India Nifty Smallcap 250 Index Fund - Direct Plan,25.70,14/28,--,--,--,--,--,--,--,--
Nippon India Pharma Fund - Direct Plan,26.26,6/11,22.98,7/9,15.42,1/3,--,--,--,--
Nippon India Power & Infra Fund - Direct Plan,33.03,2/19,32.32,11/19,16.58,7/19,--,--,--,--
Nippon India Quant Fund - Direct Plan,23.24,12/33,23.54,12/19,14.05,4/10,--,--,--,--
Nippon India Retirement Fund - Wealth Creation Scheme - Direct Plan,21.03,22/68,22.36,17/54,11.97,31/35,--,--,--,--
Nippon India Small Cap Fund - Direct Plan,27.46,7/28,37.40,2/22,22.04,1/12,--,--,--,--
Nippon India Taiwan Equity Fund - Direct Plan,24.54,11/47,--,--,--,--,--,--,--,--
Nippon India US Equity Opportunities Fund - Direct Plan,18.70,21/47,14.89,10/28,--,--,--,--,--,--
Nippon India Value Fund - Direct Plan,24.76,5/21,27.55,6/16,15.76,6/13,--,--,--,--
Nippon India Vision Large & Mid Cap Fund - Direct Plan,23.36,6/32,25.30,10/25,12.98,16/18,--,--,--,--
NJ ELSS Tax Saver Scheme - Direct Plan,--,--,--,--,--,--,--,--,--,--
NJ Flexi Cap Fund - Direct Plan,--,--,--,--,--,--,--,--,--,--
Old Bridge Focused Fund - Direct Plan,--,--,--,--,--,--,--,--,--,--
Parag Parikh ELSS Tax Saver Fund - Direct Plan,21.81,9/33,24.74,9/33,--,--,--,--,--,--
Parag Parikh Flexi Cap Fund - Direct Plan,23.32,11/68,25.01,11/54,18.23,1/35,--,--,--,--
PGIM India ELSS Tax Saver Fund - Direct Plan,17.00,29/33,22.13,18/33,--,--,--,--,--,--
PGIM India Emerging Markets Equity FoF - Direct Plan,12.32,33/47,2.91,27/28,3.71,22/23,--,--,--,--
PGIM India Flexi Cap Fund - Direct Plan,16.07,56/68,21.74,22/54,14.85,9/35,--,--,--,--
PGIM India Global Equity Opportunities FoF - Direct Plan,20.27,19/47,10.96,16/28,12.11,6/23,--,--,--,--
PGIM India Global Select Real Estate Securities FoF - Direct Plan,6.73,43/47,--,--,--,--,--,--,--,--
PGIM India Healthcare Fund - Direct Plan,--,--,--,--,--,--,--,--,--,--
PGIM India Large and Mid Cap Fund - Direct Plan,--,--,--,--,--,--,--,--,--,--
PGIM India Large Cap Fund - Direct Plan,15.59,46/78,17.58,51/57,11.70,38/42,--,--,--,--
PGIM India Midcap Fund - Direct Plan,16.92,31/32,28.58,14/25,16.40,9/19,--,--,--,--
PGIM India Multi Cap Fund - Direct Plan,--,--,--,--,--,--,--,--,--,--
PGIM India Retirement Fund - Direct Plan,--,--,--,--,--,--,--,--,--,--
PGIM India Small Cap Fund - Direct Plan,18.12,28/28,--,--,--,--,--,--,--,--
Quant BFSI Fund - Direct Plan,--,--,--,--,--,--,--,--,--,--
Quant Business Cycle Fund - Direct Plan,--,--,--,--,--,--,--,--,--,--
Quant Commodities Fund - Direct Plan,--,--,--,--,--,--,--,--,--,--
Quant Consumption Fund - Direct Plan,--,--,--,--,--,--,--,--,--,--
Quant ELSS Tax Saver Fund - Direct Plan,19.00,19/33,31.49,1/33,21.13,1/26,--,--,--,--
Quant ESG Integration Strategy Fund - Direct Plan,19.99,2/9,--,--,--,--,--,--,--,--
Quant Flexi Cap Fund - Direct Plan,21.68,16/68,31.05,--,19.05,--,--,--,--,--
Quant Focused Fund - Direct Plan,19.12,10/78,24.76,3/57,15.29,--,--,--,--,--
Quant Healthcare Fund - Direct Plan,--,--,--,--,--,--,--,--,--,--
Quant Infrastructure Fund - Direct Plan,22.47,18/19,38.95,1/19,18.85,1/19,--,--,--,--
Quant Large and Mid Cap Fund - Direct Plan,21.44,12/32,25.47,9/25,16.80,--,--,--,--,--
Quant Large Cap Fund - Direct Plan,--,--,--,--,--,--,--,--,--,--
Quant Manufacturing Fund - Direct Plan,--,--,--,--,--,--,--,--,--,--
Quant Mid Cap Fund - Direct Plan,22.87,21/32,32.45,4/25,17.83,--,--,--,--,--
Quant Momentum Fund - Direct Plan,--,--,--,--,--,--,--,--,--,--
Quant Multi Cap Fund - Direct Plan,16.69,14/14,27.72,--,18.02,--,--,--,--,--
Quant PSU Fund - Direct Plan,--,--,--,--,--,--,--,--,--,--
Quant Quantamental Fund - Direct Plan,25.76,5/33,--,--,--,--,--,--,--,--
Quant Small Cap Fund - Direct Plan,29.36,4/28,42.44,1/22,20.54,--,--,--,--,--
Quant Teck Fund - Direct Plan,--,--,--,--,--,--,--,--,--,--
Quantum ELSS Tax Saver Fund - Direct Plan,19.89,15/33,22.47,17/33,12.76,22/26,12.95,1/1,--,--
Quantum Equity FoF - Direct Plan,18.46,37/68,20.19,36/54,12.71,28/35,12.94,1/1,--,--
Quantum ESG Best In Class Strategy Fund - Direct Plan,16.01,6/9,19.78,1/3,--,--,--,--,--,--
Quantum Ethical Fund - Direct Plan,--,--,--,--,--,--,--,--,--,--
Quantum Nifty 50 ETF,15.51,68/121,18.55,48/97,12.44,18/60,11.76,16/44,--,--
Quantum Nifty 50 ETF FoF - Direct Plan,--,--,--,--,--,--,--,--,--,--
Quantum Small Cap Fund - Direct Plan,--,--,--,--,--,--,--,--,--,--
Quantum Value Fund - Direct Plan,19.88,20/21,22.50,15/16,12.65,13/13,12.96,1/1,--,--
Quant Value Fund - Direct Plan,28.25,1/21,--,--,--,--,--,--,--,--
Samco Active Momentum Fund - Direct Plan,--,--,--,--,--,--,--,--,--,--
Samco ELSS Tax Saver Fund - Direct Plan,--,--,--,--,--,--,--,--,--,--
Samco Flexi Cap Fund - Direct Plan,6.55,68/68,--,--,--,--,--,--,--,--
Samco Large Cap Fund - Direct Plan,--,--,--,--,--,--,--,--,--,--
Samco Large & Mid Cap Fund - Direct Plan,--,--,--,--,--,--,--,--,--,--
Samco Multi Cap Fund - Direct Plan,--,--,--,--,--,--,--,--,--,--
Samco Special Opportunities Fund - Direct Plan,--,--,--,--,--,--,--,--,--,--
SBI Automotive Opportunities Fund - Direct Plan,--,--,--,--,--,--,--,--,--,--
SBI Banking & Financial Services Fund - Direct Plan,22.48,4/17,23.12,4/12,17.09,1/10,--,--,--,--
SBI BSE 100 ETF,16.55,47/121,19.63,26/97,12.90,6/60,--,--,--,--
SBI BSE PSU Bank ETF,--,--,--,--,--,--,--,--,--,--
SBI BSE PSU Bank Index Fund - Direct Plan,--,--,--,--,--,--,--,--,--,--
SBI BSE Sensex ETF,14.80,97/121,17.70,73/97,12.50,14/60,--,--,--,--
SBI BSE Sensex Index Fund - Direct Plan,--,--,--,--,--,--,--,--,--,--
SBI BSE Sensex Next 50 ETF,21.96,4/121,25.41,3/97,--,--,--,--,--,--
SBI Comma Fund - Direct Plan,19.20,23/33,22.72,13/19,15.71,2/10,--,--,--,--
SBI Consumption Opportunities Fund - Direct Plan,18.33,9/11,27.55,1/11,16.48,3/7,--,--,--,--
SBI Contra Fund - Direct Plan,23.73,8/21,32.37,1/16,16.50,4/13,--,--,--,--
SBI Dividend Yield Fund - Direct Plan,--,--,--,--,--,--,--,--,--,--
SBI ELSS Tax Saver Fund - Direct Plan,27.12,2/33,26.95,3/33,14.86,10/26,--,--,--,--
SBI Energy Opportunities Fund - Direct Plan,--,--,--,--,--,--,--,--,--,--
SBI Equity Minimum Variance Fund - Direct Plan,15.26,30/33,18.43,17/19,--,--,--,--,--,--
SBI ESG Exclusionary Strategy Fund - Direct Plan,15.47,7/9,18.83,2/3,12.82,1/1,--,--,--,--
SBI Flexicap Fund - Direct Plan,15.31,60/68,19.84,38/54,13.43,22/35,--,--,--,--
SBI Focused Fund - Direct Plan,17.96,42/68,21.02,27/54,15.54,6/35,--,--,--,--
SBI Healthcare Opportunities Fund - Direct Plan,29.96,2/11,25.15,2/9,13.23,2/3,--,--,--,--
SBI Infrastructure Fund - Direct Plan,26.23,14/19,28.38,17/19,15.89,13/19,--,--,--,--
SBI Innovative Opportunities Fund - Direct Plan,--,--,--,--,--,--,--,--,--,--
SBI Large Cap Fund - Direct Plan,16.72,41/78,20.15,24/57,13.12,11/42,--,--,--,--
SBI Large & Midcap Fund - Direct Plan,21.18,14/32,25.69,7/25,15.24,11/18,--,--,--,--
SBI Midcap Fund - Direct Plan,19.62,29/32,28.41,15/25,15.39,15/19,--,--,--,--
SBI MNC Fund - Direct Plan,10.95,4/4,16.43,2/4,11.19,1/3,--,--,--,--
SBI Multicap Fund - Direct Plan,20.55,11/14,--,--,--,--,--,--,--,--
SBI Nifty100 Low Volatility 30 Index Fund - Direct Plan,--,--,--,--,--,--,--,--,--,--
SBI Nifty200 Momentum 30 Index Fund - Direct Plan,--,--,--,--,--,--,--,--,--,--
SBI Nifty 200 Quality 30 ETF,13.88,36/36,16.86,26/26,--,--,--,--,--,--
SBI Nifty200 Quality 30 Index Fund - Direct Plan,--,--,--,--,--,--,--,--,--,--
SBI Nifty 500 Index Fund - Direct Plan,--,--,--,--,--,--,--,--,--,--
SBI Nifty 50 Equal Weight ETF,--,--,--,--,--,--,--,--,--,--
SBI Nifty50 Equal Weight Index Fund - Direct Plan,--,--,--,--,--,--,--,--,--,--
SBI Nifty 50 ETF,15.54,63/121,18.59,41/97,12.57,10/60,--,--,--,--
SBI Nifty Bank ETF,16.19,19/31,20.64,12/21,12.03,7/15,--,--,--,--
SBI Nifty Bank Index Fund - Direct Plan,--,--,--,--,--,--,--,--,--,--
SBI Nifty Consumption ETF,17.18,8/15,--,--,--,--,--,--,--,--
SBI Nifty Index Fund - Direct Plan,15.33,55/78,18.35,36/57,12.19,26/42,--,--,--,--
SBI Nifty India Consumption Index Fund - Direct Plan,--,--,--,--,--,--,--,--,--,--
SBI Nifty IT ETF,9.89,11/13,--,--,--,--,--,--,--,--
SBI Nifty IT Index Fund - Direct Plan,--,--,--,--,--,--,--,--,--,--
SBI Nifty Midcap 150 Index Fund - Direct Plan,--,--,--,--,--,--,--,--,--,--
SBI Nifty Next 50 ETF,19.34,12/121,21.21,15/97,13.46,3/60,--,--,--,--
SBI Nifty Next 50 Index Fund - Direct Plan,19.07,15/78,--,--,--,--,--,--,--,--
SBI Nifty Private Bank ETF,14.66,29/31,--,--,--,--,--,--,--,--
SBI Nifty Smallcap 250 Index Fund - Direct Plan,--,--,--,--,--,--,--,--,--,--
SBI PSU Fund - Direct Plan,36.36,2/3,31.11,2/3,13.45,2/2,--,--,--,--
SBI Quant Fund - Direct Plan,--,--,--,--,--,--,--,--,--,--
SBI Retirement Benefit Fund - Aggressive Plan - Direct Plan,16.92,53/68,--,--,--,--,--,--,--,--
SBI Small Cap Fund - Direct Plan,20.36,25/28,28.83,21/22,19.61,3/12,--,--,--,--
SBI Technology Opportunities Fund - Direct Plan,18.91,3/6,25.46,2/5,17.72,3/4,--,--,--,--
SBI US Specific Equity Active FoF - Direct Plan,21.70,14/47,--,--,--,--,--,--,--,--
Shriram ELSS Tax Saver Fund - Direct Plan,14.33,33/33,16.04,32/33,--,--,--,--,--,--
Shriram Flexi Cap Fund - Direct Plan,14.45,62/68,16.71,50/54,--,--,--,--,--,--
Shriram Multi Sector Rotation Fund - Direct Plan,--,--,--,--,--,--,--,--,--,--
Sundaram Business Cycle Fund - Direct Plan,--,--,--,--,--,--,--,--,--,--
Sundaram Consumption Fund - Direct Plan,18.95,5/11,20.95,10/11,14.63,6/7,--,--,--,--
Sundaram Diversified Equity Fund - Direct Plan,16.07,--,20.39,--,11.73,--,--,--,--,--
Sundaram Dividend Yield Fund - Direct Plan,18.82,8/8,21.33,6/6,14.66,3/5,--,--,--,--
Sundaram ELSS Tax Saver Fund - Direct Plan,17.67,28/33,21.70,24/33,13.11,17/26,--,--,--,--
Sundaram Financial Services Opportunities Fund - Direct Plan,23.17,2/17,24.26,2/12,14.71,3/10,--,--,--,--
Sundaram Flexi Cap Fund - Direct Plan,--,--,--,--,--,--,--,--,--,--
Sundaram Focused Fund - Direct Plan,17.47,50/68,20.37,32/54,13.83,19/35,--,--,--,--
Sundaram Global Brand Theme - Equity Active FoF - Direct Plan,18.63,--,14.93,--,11.42,--,--,--,--,--
Sundaram Infrastructure Advantage Fund - Direct Plan,25.60,15/19,28.83,16/19,14.07,17/19,--,--,--,--
Sundaram Large and Mid Cap Fund - Direct Plan,18.98,24/32,23.05,20/25,15.27,10/18,--,--,--,--
Sundaram Large Cap Fund - Direct Plan,15.79,44/78,18.33,40/57,12.66,16/42,--,--,--,--
Sundaram Mid Cap Fund - Direct Plan,26.72,8/32,29.23,13/25,15.42,14/19,--,--,--,--
Sundaram Multi Cap Fund - Direct Plan,20.10,12/14,23.79,--,14.99,--,--,--,--,--
Sundaram Multi-Factor Fund - Direct Plan,--,--,--,--,--,--,--,--,--,--
Sundaram Nifty 100 Equal Weight Fund - Direct Plan,18.41,30/78,21.84,7/57,11.59,40/42,--,--,--,--
Sundaram Services Fund - Direct Plan,22.31,18/33,27.09,8/19,--,--,--,--,--,--
Sundaram Small Cap Fund - Direct Plan,24.63,16/28,32.80,13/22,15.07,11/12,--,--,--,--
Tata Banking and Financial Services Fund - Direct Plan,23.13,3/17,22.29,7/12,--,--,--,--,--,--
Tata BSE Quality Index Fund - Direct Plan,--,--,--,--,--,--,--,--,--,--
Tata BSE Select Business Groups Index Fund - Direct Plan,--,--,--,--,--,--,--,--,--,--
Tata BSE Sensex Index Fund - Direct Plan,14.44,76/78,17.18,56/57,12.12,30/42,--,--,--,--
Tata Business Cycle Fund - Direct Plan,23.88,9/33,--,--,--,--,--,--,--,--
Tata Children's Fund - Direct Plan,17.13,52/68,20.10,--,12.25,--,--,--,--,--
Tata Digital India Fund - Direct Plan,15.95,4/6,24.98,3/5,--,--,--,--,--,--
Tata Dividend Yield Fund - Direct Plan,20.66,6/8,--,--,--,--,--,--,--,--
Tata ELSS Fund - Direct Plan,18.85,20/33,21.89,23/33,15.19,7/26,--,--,--,--
Tata Ethical Fund - Direct Plan,13.55,31/33,20.05,15/19,12.35,9/10,--,--,--,--
Tata Flexi Cap Fund - Direct Plan,19.08,32/68,19.79,40/54,--,--,--,--,--,--
Tata Focused Fund - Direct Plan,18.80,33/68,22.22,18/54,--,--,--,--,--,--
Tata Housing Opportunities Fund - Direct Plan,--,--,--,--,--,--,--,--,--,--
Tata India Consumer Fund - Direct Plan,20.91,1/11,22.98,5/11,--,--,--,--,--,--
Tata India Innovation Fund - Direct Plan,--,--,--,--,--,--,--,--,--,--
Tata India Pharma & Healthcare Fund - Direct Plan,26.35,5/11,23.61,4/9,--,--,--,--,--,--
Tata Infrastructure Fund - Direct Plan,24.23,16/19,31.39,13/19,15.33,14/19,--,--,--,--
Tata Large Cap Fund - Direct Plan,17.32,37/78,20.31,20/57,12.59,18/42,--,--,--,--
Tata Large & Mid Cap Fund - Direct Plan,19.41,23/32,21.82,24/25,14.44,12/18,--,--,--,--
Tata Mid Cap Fund - Direct Plan,23.69,19/32,27.98,17/25,16.36,10/19,--,--,--,--
Tata Multicap Fund - Direct Plan,--,--,--,--,--,--,--,--,--,--
Tata Nifty200 Alpha 30 Index Fund - Direct Plan,--,--,--,--,--,--,--,--,--,--
Tata Nifty500 Multicap India Manufacturing 50:30:20 Index Fund - Direct Plan,--,--,--,--,--,--,--,--,--,--
