HDFC Housing Opportunities Fund - Direct Plan,23.88,10/33,25.73,10/19,--,--,--,--,--,--
HDFC Infrastructure Fund - Direct Plan,32.57,3/19,35.80,3/19,12.04,19/19,--,--,--,--
HDFC Innovation Fund - Direct Plan,--,--,--,--,--,--,--,--,--,--
HDFC Large and Mid Cap Fund - Direct Plan,23.32,7/32,27.90,4/25,14.36,13/18,--,--,--,--
HDFC Large Cap Fund - Direct Plan,19.16,9/78,22.04,6/57,13.31,9/42,--,--,--,--
HDFC Manufacturing Fund - Direct Plan,--,--,--,--,--,--,--,--,--,--
HDFC Mid Cap Fund - Direct Plan,29.24,3/32,32.49,3/25,18.55,4/19,--,--,--,--
HDFC MNC Fund - Direct Plan,--,--,--,--,--,--,--,--,--,--
HDFC Multi Cap Fund - Direct Plan,25.22,4/14,--,--,--,--,--,--,--,--
HDFC NIFTY 100 Equal Weight Index Fund - Direct Plan,18.50,29/78,--,--,--,--,--,--,--,--
HDFC NIFTY 100 ETF,--,--,--,--,--,--,--,--,--,--
HDFC NIFTY 100 Index Fund - Direct Plan,15.33,57/78,--,--,--,--,--,--,--,--
HDFC NIFTY100 Low Volatility 30 ETF,--,--,--,--,--,--,--,--,--,--
HDFC NIFTY100 Low Volatility 30 Index Fund - Direct Plan,--,--,--,--,--,--,--,--,--,--
HDFC NIFTY100 Quality 30 ETF,--,--,--,--,--,--,--,--,--,--
HDFC Nifty100 Quality 30 Index Fund - Direct Plan,--,--,--,--,--,--,--,--,--,--
HDFC NIFTY200 Momentum 30 ETF,--,--,--,--,--,--,--,--,--,--
HDFC NIFTY200 Momentum 30 Index Fund - Direct Plan,--,--,--,--,--,--,--,--,--,--
HDFC Nifty500 Multicap 50:25:25 Index Fund - Direct Plan,--,--,--,--,--,--,--,--,--,--
HDFC NIFTY50 Equal Weight Index Fund - Direct Plan,18.64,26/78,--,--,--,--,--,--,--,--
HDFC NIFTY 50 ETF,15.55,62/121,18.60,39/97,--,--,--,--,--,--
HDFC NIFTY 50 Index Fund Direct Plan,15.32,58/78,18.36,34/57,12.28,23/42,--,--,--,--
HDFC NIFTY50 Value 20 ETF,--,--,--,--,--,--,--,--,--,--
HDFC NIFTY Bank ETF,16.17,22/31,--,--,--,--,--,--,--,--
HDFC NIFTY Growth Sectors 15 ETF,--,--,--,--,--,--,--,--,--,--
HDFC Nifty India Digital Index Fund - Direct Plan,--,--,--,--,--,--,--,--,--,--
HDFC NIFTY IT ETF,--,--,--,--,--,--,--,--,--,--
HDFC Nifty LargeMidcap 250 Index Fund - Direct Plan,--,--,--,--,--,--,--,--,--,--
HDFC NIFTY Midcap 150 ETF,--,--,--,--,--,--,--,--,--,--
HDFC NIFTY Midcap 150 Index Fund - Direct Plan,--,--,--,--,--,--,--,--,--,--
HDFC NIFTY Next 50 ETF,--,--,--,--,--,--,--,--,--,--
HDFC NIFTY Next 50 Index Fund - Direct Plan,18.80,20/78,--,--,--,--,--,--,--,--
HDFC NIFTY Private Bank ETF,--,--,--,--,--,--,--,--,--,--
HDFC NIFTY PSU BANK ETF,--,--,--,--,--,--,--,--,--,--
HDFC NIFTY Realty Index Fund - Direct Plan,--,--,--,--,--,--,--,--,--,--
HDFC Nifty Smallcap 250 ETF,--,--,--,--,--,--,--,--,--,--
HDFC Nifty Smallcap 250 Index Fund - Direct Plan,--,--,--,--,--,--,--,--,--,--
HDFC Nifty Top 20 Equal Weight Index Fund - Direct Plan,--,--,--,--,--,--,--,--,--,--
HDFC Non-Cyclical Consumer Fund - Direct Plan,--,--,--,--,--,--,--,--,--,--
HDFC Pharma And Healthcare Fund - Direct Plan,--,--,--,--,--,--,--,--,--,--
HDFC Retirement Savings Fund Equity Plan - Direct Plan,21.88,14/68,26.86,6/54,--,--,--,--,--,--
HDFC Small Cap Fund - Direct Plan,27.15,10/28,34.84,7/22,19.52,4/12,--,--,--,--
HDFC Technology Fund - Direct Plan,--,--,--,--,--,--,--,--,--,--
HDFC Transportation and Logistics Fund - Direct Plan,--,--,--,--,--,--,--,--,--,--
HDFC Value Fund - Direct Plan,22.57,14/21,24.58,10/16,14.79,10/13,--,--,--,--
Helios Financial Services Fund - Direct Plan,--,--,--,--,--,--,--,--,--,--
Helios Flexi Cap Fund - Direct Plan,--,--,--,--,--,--,--,--,--,--
Helios Large & Mid Cap Fund - Direct Plan,--,--,--,--,--,--,--,--,--,--
Helios Mid Cap Fund - Direct Plan,--,--,--,--,--,--,--,--,--,--
HSBC Asia Pacific (Ex Japan) Dividend Yield Fund - Direct Plan,14.65,27/47,10.93,17/28,10.17,9/23,--,--,--,--
HSBC Brazil Fund - Direct Plan,8.10,42/47,1.49,28/28,3.36,23/23,--,--,--,--
HSBC Business Cycles Fund - Direct Plan,25.26,6/33,27.64,7/19,13.96,5/10,--,--,--,--
HSBC Consumption Fund - Direct Plan,--,--,--,--,--,--,--,--,--,--
HSBC ELSS Tax Saver Fund - Direct Plan,22.62,5/33,22.75,16/33,13.87,14/26,--,--,--,--
HSBC Financial Services Fund - Direct Plan,--,--,--,--,--,--,--,--,--,--
HSBC Flexi Cap Fund - Direct Plan,22.71,13/68,22.61,15/54,13.26,23/35,--,--,--,--
HSBC Focused Fund - Direct Plan,18.45,38/68,19.68,41/54,--,--,--,--,--,--
HSBC Global Emerging Markets Fund - Direct Plan,9.95,40/47,7.47,23/28,8.29,14/23,--,--,--,--
HSBC Global Equity Climate Change FoF - Direct Plan,10.67,39/47,--,--,--,--,--,--,--,--
HSBC India Export Opportunities Fund - Direct Plan,--,--,--,--,--,--,--,--,--,--
HSBC Infrastructure Fund - Direct Plan,27.58,12/19,31.31,15/19,16.02,11/19,--,--,--,--
HSBC Large and Mid Cap Fund - Direct Plan,23.23,8/32,23.24,18/25,--,--,--,--,--,--
HSBC Large Cap Fund - Direct Plan,16.98,39/78,18.76,28/57,12.64,17/42,--,--,--,--
HSBC Midcap Fund - Direct Plan,25.93,10/32,26.81,20/25,16.83,7/19,--,--,--,--
HSBC Multi Cap Fund - Direct Plan,--,--,--,--,--,--,--,--,--,--
HSBC Nifty 50 Index Fund - Direct Plan,15.30,60/78,18.33,39/57,--,--,--,--,--,--
HSBC Nifty Next 50 Index Fund - Direct Plan,18.79,21/78,20.70,16/57,--,--,--,--,--,--
HSBC Small Cap Fund - Direct Plan,24.43,17/28,35.42,4/22,17.80,7/12,--,--,--,--
HSBC Tax Saver Equity Fund - Direct Plan,22.66,--,23.99,--,14.34,--,--,--,--,--
HSBC Value Fund - Direct Plan,27.39,3/21,28.35,4/16,16.86,2/13,--,--,--,--
ICICI Prudential Active Momentum Fund - Direct Plan,--,--,--,--,--,--,--,--,--,--
ICICI Prudential Banking and Financial Services Fund - Direct Plan,19.29,11/17,22.27,8/12,14.47,4/10,--,--,--,--
ICICI Prudential BHARAT 22 FOF - Direct Plan,29.12,1/78,32.14,1/57,--,--,--,--,--,--
ICICI Prudential Bharat Consumption Fund - Direct Plan,18.85,6/11,22.13,7/11,--,--,--,--,--,--
ICICI Prudential BSE 500 ETF,17.71,33/70,21.23,17/55,--,--,--,--,--,--
ICICI Prudential BSE 500 ETF FOF - Direct Plan,17.73,46/68,--,--,--,--,--,--,--,--
ICICI Prudential BSE Midcap Select ETF,20.17,33/39,24.28,25/29,--,--,--,--,--,--
ICICI Prudential BSE Sensex ETF,14.85,90/121,17.73,69/97,12.50,16/60,11.92,14/44,13.83,10/29
ICICI Prudential BSE Sensex Index Fund - Direct Plan,14.58,73/78,17.41,54/57,--,--,--,--,--,--
ICICI Prudential Business Cycle Fund - Direct Plan,24.98,8/33,--,--,--,--,--,--,--,--
ICICI Prudential Commodities Fund - Direct Plan,23.61,11/33,35.83,1/19,--,--,--,--,--,--
ICICI Prudential Dividend Yield Equity Fund - Direct Plan,26.99,1/8,30.63,1/6,16.61,1/5,--,--,--,--
ICICI Prudential ELSS Tax Saver - Direct Plan,18.22,25/33,22.01,21/33,13.81,15/26,--,--,--,--
ICICI Prudential Energy Opportunities Fund - Direct Plan,--,--,--,--,--,--,--,--,--,--
ICICI Prudential Equity Minimum Variance Fund - Direct Plan,--,--,--,--,--,--,--,--,--,--
ICICI Prudential ESG Exclusionary Strategy Fund - Direct Plan,22.53,1/9,--,--,--,--,--,--,--,--
ICICI Prudential Exports and Services Fund - Direct Plan,22.75,15/33,25.32,11/19,14.18,3/10,--,--,--,--
ICICI Prudential Flexicap Fund - Direct Plan,20.85,23/68,--,--,--,--,--,--,--,--
ICICI Prudential FMCG Fund - Direct Plan,9.78,33/33,15.34,19/19,12.32,10/10,--,--,--,--
ICICI Prudential Focused Equity Fund - Direct Plan,25.53,6/68,26.43,8/54,16.05,5/35,--,--,--,--
ICICI Prudential Global Advantage Fund (FOF) - Direct Plan,14.58,28/47,9.86,20/28,--,--,--,--,--,--
ICICI Prudential Global Stable Equity Fund (FOF) - Direct Plan,11.16,37/47,11.83,14/28,9.61,12/23,--,--,--,--
ICICI Prudential Housing Opportunities Fund - Direct Plan,21.27,19/33,--,--,--,--,--,--,--,--
ICICI Prudential India Equity FOF - Direct Plan,23.23,12/68,27.85,5/54,--,--,--,--,--,--
ICICI Prudential India Opportunities Fund - Direct Plan,26.92,4/33,32.63,2/19,--,--,--,--,--,--
ICICI Prudential Infrastructure Fund - Direct Plan,33.03,1/19,37.59,2/19,16.98,5/19,--,--,--,--
ICICI Prudential Innovation Fund - Direct Plan,--,--,--,--,--,--,--,--,--,--
ICICI Prudential Large Cap Fund - Direct Plan,20.49,4/78,22.52,5/57,14.63,2/42,--,--,--,--
ICICI Prudential Large & Mid Cap Fund - Direct Plan,23.85,5/32,28.50,2/25,16.43,5/18,--,--,--,--
ICICI Prudential Manufacturing Fund - Direct Plan,28.33,3/33,30.19,4/19,--,--,--,--,--,--
ICICI Prudential Midcap Fund - Direct Plan,24.46,18/32,29.65,11/25,16.10,12/19,--,--,--,--
ICICI Prudential MNC Fund - Direct Plan,15.96,1/4,23.08,1/4,--,--,--,--,--,--
ICICI Prudential Multicap Fund - Direct Plan,23.31,7/14,26.16,--,15.44,--,--,--,--,--
ICICI Prudential NASDAQ 100 Index Fund - Direct Plan,27.00,5/47,--,--,--,--,--,--,--,--
ICICI Prudential Nifty 100 ETF,15.27,75/121,18.36,55/97,12.24,24/60,--,--,--,--
ICICI Prudential Nifty 100 Low Volatility 30 ETF,17.15,43/121,18.88,33/97,--,--,--,--,--,--
ICICI Prudential Nifty 100 Low Volatility 30 ETF FOF - Direct Plan,16.97,40/78,--,--,--,--,--,--,--,--
ICICI Prudential Nifty 200 Momentum 30 ETF,--,--,--,--,--,--,--,--,--,--
ICICI Prudential Nifty 200 Momentum 30 Index Fund - Direct Plan,--,--,--,--,--,--,--,--,--,--
ICICI Prudential Nifty 200 Quality 30 ETF,--,--,--,--,--,--,--,--,--,--
ICICI Prudential Nifty200 Quality 30 Index Fund - Direct Plan,--,--,--,--,--,--,--,--,--,--
ICICI Prudential Nifty200 Value 30 ETF,--,--,--,--,--,--,--,--,--,--
ICICI Prudential Nifty200 Value 30 Index Fund - Direct Plan,--,--,--,--,--,--,--,--,--,--
ICICI Prudential Nifty 500 Index Fund - Direct Plan,--,--,--,--,--,--,--,--,--,--
ICICI Prudential Nifty50 Equal Weight Index Fund - Direct Plan,--,--,--,--,--,--,--,--,--,--
ICICI Prudential Nifty 50 ETF,15.58,56/121,18.62,36/97,12.55,11/60,--,--,--,--
ICICI Prudential Nifty 50 Index Fund - Direct Plan,15.30,59/78,18.34,37/57,12.19,27/42,--,--,--,--
ICICI Prudential Nifty50 Value 20 ETF,15.64,23/25,20.46,17/20,--,--,--,--,--,--
ICICI Prudential Nifty50 Value 20 Index Fund - Direct Plan,--,--,--,--,--,--,--,--,--,--
ICICI Prudential Nifty Alpha Low Volatility 30 ETF,18.79,20/36,--,--,--,--,--,--,--,--
ICICI Prudential Nifty Alpha Low Volatility 30 ETF FOF - Direct Plan,18.57,26/32,--,--,--,--,--,--,--,--
ICICI Prudential Nifty Auto ETF,24.85,5/38,--,--,--,--,--,--,--,--
ICICI Prudential Nifty Auto Index Fund - Direct Plan,--,--,--,--,--,--,--,--,--,--
ICICI Prudential Nifty Bank ETF,16.23,17/31,20.69,10/21,--,--,--,--,--,--
ICICI Prudential Nifty Bank Index Fund - Direct Plan,15.98,17/17,--,--,--,--,--,--,--,--
ICICI Prudential Nifty Commodities ETF,--,--,--,--,--,--,--,--,--,--
ICICI Prudential Nifty EV & New Age Automotive ETF,--,--,--,--,--,--,--,--,--,--
ICICI Prudential Nifty EV & New Age Automotive ETF FoF - Direct Plan,--,--,--,--,--,--,--,--,--,--
ICICI Prudential Nifty Financial Services Ex-Bank ETF,--,--,--,--,--,--,--,--,--,--
ICICI Prudential Nifty FMCG ETF,10.40,37/38,--,--,--,--,--,--,--,--
ICICI Prudential Nifty Healthcare ETF,24.43,8/15,--,--,--,--,--,--,--,--
ICICI Prudential Nifty India Consumption ETF,17.28,7/15,--,--,--,--,--,--,--,--
ICICI Prudential Nifty Infrastructure ETF,--,--,--,--,--,--,--,--,--,--
ICICI Prudential Nifty IT ETF,9.94,9/13,--,--,--,--,--,--,--,--
ICICI Prudential Nifty IT Index Fund - Direct Plan,--,--,--,--,--,--,--,--,--,--
ICICI Prudential Nifty LargeMidcap 250 Index Fund - Direct Plan,--,--,--,--,--,--,--,--,--,--
ICICI Prudential Nifty Metal ETF,--,--,--,--,--,--,--,--,--,--
ICICI Prudential Nifty Midcap 150 ETF,25.60,11/39,30.05,8/29,--,--,--,--,--,--
ICICI Prudential Nifty Midcap 150 Index Fund - Direct Plan,25.17,16/32,--,--,--,--,--,--,--,--
ICICI Prudential Nifty Next 50 ETF,19.36,11/121,21.39,10/97,--,--,--,--,--,--
ICICI Prudential Nifty Next 50 Index Fund - Direct Plan,18.95,18/78,20.86,12/57,13.06,12/42,--,--,--,--
ICICI Prudential Nifty Oil & Gas ETF,--,--,--,--,--,--,--,--,--,--
ICICI Prudential Nifty Pharma Index Fund - Direct Plan,--,--,--,--,--,--,--,--,--,--
ICICI Prudential Nifty Private Bank ETF,14.65,30/31,17.70,20/21,--,--,--,--,--,--
ICICI Prudential Nifty Private Bank Index Fund - Direct Plan,--,--,--,--,--,--,--,--,--,--
ICICI Prudential Nifty PSU Bank ETF,--,--,--,--,--,--,--,--,--,--
ICICI Prudential Nifty Smallcap 250 Index Fund - Direct Plan,25.95,12/28,--,--,--,--,--,--,--,--
ICICI Prudential Nifty Top 15 Equal Weight ETF,--,--,--,--,--,--,--,--,--,--
ICICI Prudential Nifty Top 15 Equal Weight Index Fund - Direct Plan,--,--,--,--,--,--,--,--,--,--
ICICI Prudential Passive Strategy Fund (FOF) - Direct Plan,19.98,27/68,22.42,16/54,13.35,--,--,--,--,--
ICICI Prudential Pharma Healthcare and Diagnostics (P.H.D) Fund - Direct Plan,30.75,1/11,25.36,1/9,--,--,--,--,--,--
ICICI Prudential PSU Equity Fund - Direct Plan,--,--,--,--,--,--,--,--,--,--
ICICI Prudential Quality Fund - Direct Plan,--,--,--,--,--,--,--,--,--,--
ICICI Prudential Quant Fund - Direct Plan,19.17,24/33,--,--,--,--,--,--,--,--
ICICI Prudential Retirement Fund - Pure Equity Plan - Direct Plan,27.49,2/68,29.80,1/54,--,--,--,--,--,--
ICICI Prudential Rural Opportunities Fund - Direct Plan,--,--,--,--,--,--,--,--,--,--
ICICI Prudential Smallcap Fund - Direct Plan,20.78,24/28,32.79,14/22,16.53,9/12,--,--,--,--
ICICI Prudential Strategic Metal and Energy Equity FoF - Direct Plan,18.54,22/47,--,--,--,--,--,--,--,--
ICICI Prudential Technology Fund - Direct Plan,15.56,5/6,25.97,1/5,18.03,2/4,--,--,--,--
ICICI Prudential Thematic Advantage Fund (FOF) - Direct,22.80,14/33,27.70,6/19,16.74,--,--,--,--,--
ICICI Prudential Transportation and Logistics Fund - Direct Plan,--,--,--,--,--,--,--,--,--,--
ICICI Prudential US Bluechip Equity Fund - Direct Plan,16.67,25/47,15.87,7/28,15.14,2/23,--,--,--,--
ICICI Prudential Value Fund - Direct Plan,24.00,7/21,27.47,7/16,15.67,7/13,--,--,--,--
Invesco India Business Cycle Fund - Direct Plan,--,--,--,--,--,--,--,--,--,--
Invesco India Contra Fund - Direct Plan,23.73,9/21,24.28,11/16,16.91,1/13,--,--,--,--
Invesco India ELSS Tax Saver Fund - Direct Plan,20.84,12/33,21.13,26/33,14.63,11/26,--,--,--,--
Invesco India ESG Integration Strategy Fund - Direct Plan,16.58,4/9,--,--,--,--,--,--,--,--
Invesco India Financial Services Fund - Direct Plan,25.42,1/17,24.03,3/12,16.11,2/10,--,--,--,--
Invesco India Flexi Cap Fund - Direct Plan,26.77,3/68,--,--,--,--,--,--,--,--
Invesco India Focused Fund - Direct Plan,27.51,1/68,--,--,--,--,--,--,--,--
Invesco India Infrastructure Fund - Direct Plan,30.01,8/19,32.61,10/19,18.12,2/19,--,--,--,--
Invesco India - Invesco EQQQ NASDAQ-100 ETF FoF - Direct Plan,26.81,8/47,--,--,--,--,--,--,--,--
Invesco India - Invesco Global Consumer Trends FoF - Direct Plan,17.95,24/47,--,--,--,--,--,--,--,--
Invesco India - Invesco Global Equity Income FoF - Direct Plan,23.40,13/47,19.86,2/28,11.99,7/23,--,--,--,--
Invesco India - Invesco Pan European Equity FoF - Direct Plan,19.12,20/47,15.05,9/28,7.37,19/23,--,--,--,--
Invesco India Largecap Fund - Direct Plan,20.08,5/78,20.95,11/57,13.99,4/42,--,--,--,--
Invesco India Large & Mid Cap Fund - Direct Plan,28.91,2/32,26.54,6/25,16.97,2/18,--,--,--,--
Invesco India Manufacturing Fund - Direct Plan,--,--,--,--,--,--,--,--,--,--
Invesco India Mid Cap Fund - Direct Plan,31.42,1/32,31.30,6/25,19.39,1/19,--,--,--,--
Invesco India Multicap Fund - Direct Plan,22.60,8/14,25.29,--,15.20,--,--,--,--,--
Invesco India Nifty 50 ETF,15.48,73/121,18.53,50/97,12.50,15/60,--,--,--,--
Invesco India PSU Equity Fund - Direct Plan,36.48,1/3,29.47,3/3,17.35,1/2,--,--,--,--
Invesco India Smallcap Fund - Direct Plan,29.85,3/28,34.52,9/22,--,--,--,--,--,--
Invesco India Technology Fund - Direct Plan,--,--,--,--,--,--,--,--,--,--
ITI Banking and Financial Services Fund - Direct Plan,17.83,13/17,--,--,--,--,--,--,--,--
ITI Bharat Consumption Fund - Direct Plan,--,--,--,--,--,--,--,--,--,--
ITI ELSS Tax Saver Fund - Direct Plan,25.04,3/33,23.35,13/33,--,--,--,--,--,--
ITI Flexi Cap Fund - Direct Plan,--,--,--,--,--,--,--,--,--,--
ITI Focused Fund - Direct Plan,--,--,--,--,--,--,--,--,--,--
ITI Large Cap Fund - Direct Plan,18.08,31/78,--,--,--,--,--,--,--,--
ITI Large & Mid Cap Fund - Direct Plan,--,--,--,--,--,--,--,--,--,--
ITI Mid Cap Fund - Direct Plan,27.02,7/32,--,--,--,--,--,--,--,--
ITI Multi Cap Fund - Direct Plan,24.26,6/14,22.29,--,--,--,--,--,--,--
ITI Pharma and Healthcare Fund - Direct Plan,25.32,8/11,--,--,--,--,--,--,--,--
ITI Small Cap Fund - Direct Plan,31.56,2/28,29.93,20/22,--,--,--,--,--,--
ITI Value Fund - Direct Plan,23.47,10/21,--,--,--,--,--,--,--,--
JM ELSS Tax Saver Fund - Direct Plan,22.56,6/33,25.06,8/33,15.91,5/26,--,--,--,--
JM Flexicap Fund - Direct Plan,25.30,8/68,26.72,7/54,16.68,3/35,--,--,--,--
JM Focused Fund - Direct Plan,21.09,21/68,21.43,24/54,13.93,18/35,--,--,--,--
JM Large Cap Fund - Direct Plan,18.66,25/78,18.13,45/57,11.63,39/42,--,--,--,--
JM Large & Mid Cap Fund - Direct Plan,--,--,--,--,--,--,--,--,--,--
JM Midcap Fund - Direct Plan,--,--,--,--,--,--,--,--,--,--
JM Small Cap Fund - Direct Plan,--,--,--,--,--,--,--,--,--,--
JM Value Fund - Direct Plan,27.83,2/21,27.71,5/16,16.98,--,--,--,--,--
Kotak Active Momentum Fund - Direct Plan,--,--,--,--,--,--,--,--,--,--
Kotak Banking & Financial Services Fund - Direct Plan,--,--,--,--,--,--,--,--,--,--
Kotak BSE Housing Index Fund - Direct Plan,--,--,--,--,--,--,--,--,--,--
Kotak BSE PSU Index Fund - Direct Plan,--,--,--,--,--,--,--,--,--,--
Kotak BSE Sensex ETF,14.58,103/121,17.47,81/97,12.28,21/60,11.63,18/44,--,--
Kotak BSE Sensex Index Fund - Direct Plan,--,--,--,--,--,--,--,--,--,--
Kotak Business Cycle Fund - Direct Plan,--,--,--,--,--,--,--,--,--,--
Kotak Consumption Fund - Direct Plan,--,--,--,--,--,--,--,--,--,--
Kotak Contra Fund - Direct Plan,24.38,6/21,25.47,9/16,16.65,3/13,--,--,--,--
Kotak ELSS Tax Saver - Direct Plan,19.67,16/33,23.16,14/33,15.11,8/26,--,--,--,--
Kotak Energy Opportunities Fund - Direct Plan,--,--,--,--,--,--,--,--,--,--
Kotak ESG Exclusionary Strategy Fund - Direct Plan,17.12,3/9,--,--,--,--,--,--,--,--
Kotak Flexicap Fund - Direct Plan,19.97,28/68,20.97,28/54,14.73,10/35,--,--,--,--
Kotak Focused Fund - Direct Plan,18.71,34/68,21.57,23/54,--,--,--,--,--,--
Kotak Global Emerging Market - Direct Plan,11.71,35/47,8.22,21/28,6.99,20/23,--,--,--,--
Kotak Global Innovation FoF - Direct Plan,18.71,--,--,--,--,--,--,--,--,--
Kotak Healthcare Fund - Direct Plan,--,--,--,--,--,--,--,--,--,--
Kotak Infrastructure and Economic Reform Fund - Standard Plan - Direct Plan,27.36,13/19,33.08,9/19,16.94,6/19,--,--,--,--
Kotak International REIT FOF - Direct Plan,3.87,46/47,--,--,--,--,--,--,--,--
Kotak Large Cap Fund - Direct Plan,18.06,32/78,20.54,18/57,13.62,6/42,--,--,--,--
Kotak Large & Midcap Fund - Direct Plan,22.27,10/32,24.39,13/25,16.23,6/18,--,--,--,--
Kotak Manufacture in India Fund - Direct Plan,22.64,16/33,--,--,--,--,--,--,--,--
Kotak Midcap Fund - Direct Plan,25.17,17/32,30.94,7/25,19.06,2/19,--,--,--,--
Kotak MNC Fund - Direct Plan,--,--,--,--,--,--,--,--,--,--
Kotak MSCI India ETF,--,--,--,--,--,--,--,--,--,--
Kotak Multicap Fund - Direct Plan,26.58,2/14,--,--,--,--,--,--,--,--
Kotak Nasdaq 100 FOF - Direct Plan,26.99,7/47,--,--,--,--,--,--,--,--
Kotak Nifty 100 Equal Weight ETF,--,--,--,--,--,--,--,--,--,--
Kotak Nifty 100 Equal Weight Index Fund - Direct Plan,--,--,--,--,--,--,--,--,--,--
Kotak Nifty 100 Low Volatility 30 ETF,17.46,38/121,--,--,--,--,--,--,--,--
Kotak Nifty 100 Low Volatility 30 Index Fund - Direct Plan,--,--,--,--,--,--,--,--,--,--
Kotak Nifty 200 Momentum 30 Index Fund - Direct Plan,--,--,--,--,--,--,--,--,--,--
Kotak Nifty200 Quality 30 ETF,--,--,--,--,--,--,--,--,--,--
Kotak Nifty 200 Quality 30 Index Fund - Direct Plan,--,--,--,--,--,--,--,--,--,--
Kotak Nifty 50 Equal Weight Index Fund - Direct Plan,--,--,--,--,--,--,--,--,--,--
Kotak Nifty 50 ETF,15.49,71/121,18.53,51/97,12.32,19/60,11.61,19/44,--,--
Kotak Nifty 50 Index Fund - Direct Plan,15.21,67/78,--,--,--,--,--,--,--,--
Kotak Nifty 50 Value 20 ETF,15.79,22/25,20.57,16/20,--,--,--,--,--,--
Kotak Nifty Alpha 50 ETF,22.09,12/70,--,--,--,--,--,--,--,--
Kotak Nifty Alpha 50 Index Fund - Direct Plan,--,--,--,--,--,--,--,--,--,--
Kotak Nifty Bank ETF,16.14,23/31,20.57,14/21,11.98,8/15,--,--,--,--
Kotak Nifty Commodities Index Fund - Direct Plan,--,--,--,--,--,--,--,--,--,--
Kotak Nifty Financial Services Ex-Bank Index Fund - Direct Plan,--,--,--,--,--,--,--,--,--,--
Kotak NIFTY India Consumption ETF,--,--,--,--,--,--,--,--,--,--
Kotak Nifty India Tourism Index Fund - Direct Plan,--,--,--,--,--,--,--,--,--,--
Kotak Nifty IT ETF,10.06,8/13,--,--,--,--,--,--,--,--
Kotak Nifty Midcap 150 ETF,--,--,--,--,--,--,--,--,--,--
Kotak Nifty Midcap 150 Index Fund - Direct Plan,--,--,--,--,--,--,--,--,--,--
Kotak Nifty Midcap 150 Momentum 50 Index Fund - Direct Plan,--,--,--,--,--,--,--,--,--,--
Kotak Nifty Midcap 50 ETF,27.04,5/39,--,--,--,--,--,--,--,--
Kotak Nifty Midcap 50 Index Fund - Direct Plan,--,--,--,--,--,--,--,--,--,--
Kotak Nifty MNC ETF,--,--,--,--,--,--,--,--,--,--
Kotak Nifty Next 50 Index Fund - Direct Plan,19.27,6/78,--,--,--,--,--,--,--,--
Kotak Nifty PSU Bank ETF,36.40,1/31,37.59,2/21,7.89,14/15,4.57,8/8,--,--
Kotak Nifty Smallcap 250 Index Fund - Direct Plan,--,--,--,--,--,--,--,--,--,--
Kotak Nifty Smallcap 50 Index Fund - Direct Plan,--,--,--,--,--,--,--,--,--,--
Kotak Nifty Top 10 Equal Weight Index Fund - Direct Plan,--,--,--,--,--,--,--,--,--,--
Kotak Pioneer Fund - Direct Plan,25.01,7/33,26.89,9/19,--,--,--,--,--,--
Kotak Quant Fund - Direct Plan,--,--,--,--,--,--,--,--,--,--
Kotak Small Cap Fund - Direct Plan,20.29,26/28,32.88,12/22,18.82,5/12,--,--,--,--
Kotak Special Opportunities Fund - Direct Plan,--,--,--,--,--,--,--,--,--,--
Kotak Technology Fund - Direct Plan,--,--,--,--,--,--,--,--,--,--
Kotak Transportation & Logistics Fund - Direct Plan,--,--,--,--,--,--,--,--,--,--
LIC MF Banking & Financial Services Fund - Direct Plan,16.61,14/17,18.98,12/12,9.11,10/10,--,--,--,--
LIC MF BSE Sensex ETF,14.76,100/121,17.65,77/97,--,--,--,--,--,--
LIC MF BSE Sensex Index Plan - Direct Plan,14.44,75/78,17.24,55/57,11.79,36/42,--,--,--,--
LIC MF Children's Fund - Direct Plan,13.16,67/68,14.32,54/54,9.32,--,--,--,--,--
LIC MF Dividend Yield Fund - Direct Plan,25.03,2/8,24.38,3/6,--,--,--,--,--,--
LIC MF ELSS Tax Saver - Direct Plan,18.82,21/33,20.91,27/33,12.60,24/26,--,--,--,--
LIC MF Flexi Cap Fund - Direct Plan,16.07,57/68,18.56,46/54,10.62,34/35,--,--,--,--
LIC MF Focused Fund - Direct Plan,15.34,--,18.26,--,--,--,--,--,--,--
LIC MF Healthcare Fund - Direct Plan,22.97,10/11,18.72,9/9,--,--,--,--,--,--
LIC MF Infrastructure Fund - Direct Plan,31.66,6/19,33.36,7/19,16.01,12/19,--,--,--,--
LIC MF Large Cap Fund - Direct Plan,15.09,68/78,17.96,47/57,11.46,41/42,--,--,--,--
LIC MF Large & Mid Cap Fund - Direct Plan,19.51,22/32,23.41,17/25,15.67,8/18,--,--,--,--
LIC MF Manufacturing Fund - Direct Plan,--,--,--,--,--,--,--,--,--,--
LIC MF Midcap Fund - Direct Plan,22.83,22/32,24.88,23/25,--,--,--,--,--,--
LIC MF Multi Cap Fund - Direct Plan,--,--,--,--,--,--,--,--,--,--
LIC MF Nifty 100 ETF,15.50,70/121,18.57,45/97,--,--,--,--,--,--
LIC MF Nifty 50 ETF,15.48,72/121,18.53,49/97,--,--,--,--,--,--
LIC MF Nifty 50 Index Plan - Direct Plan,15.25,65/78,18.17,44/57,12.03,32/42,--,--,--,--
LIC MF Nifty Midcap 100 ETF,--,--,--,--,--,--,--,--,--,--
LIC MF Nifty Next 50 Index Fund - Direct Plan,19.05,16/78,20.79,13/57,13.04,13/42,--,--,--,--
LIC MF Small Cap Fund - Direct Plan,23.38,19/28,32.24,16/22,--,--,--,--,--,--
LIC MF Value Fund - Direct Plan,--,--,--,--,--,--,--,--,--,--
Mahindra Manulife Asia Pacific REITs FoF - Direct Plan,2.49,47/47,--,--,--,--,--,--,--,--
Mahindra Manulife Banking & Financial Services Fund - Direct Plan,--,--,--,--,--,--,--,--,--,--
Mahindra Manulife Business Cycle Fund - Direct Plan,--,--,--,--,--,--,--,--,--,--
Mahindra Manulife Consumption Fund - Direct Plan,18.35,8/11,21.26,9/11,--,--,--,--,--,--
Mahindra Manulife ELSS Tax Saver Fund - Direct Plan,18.24,24/33,23.06,15/33,--,--,--,--,--,--
Mahindra Manulife Flexi Cap Fund - Direct Plan,20.29,24/68,--,--,--,--,--,--,--,--
Mahindra Manulife Focused Fund - Direct Plan,23.38,10/68,--,--,--,--,--,--,--,--
Mahindra Manulife Large Cap Fund - Direct Plan,17.38,36/78,20.54,17/57,--,--,--,--,--,--
Mahindra Manulife Large & Mid Cap Fund - Direct Plan,20.44,19/32,25.63,8/25,--,--,--,--,--,--
Mahindra Manulife Manufacturing Fund - Direct Plan,--,--,--,--,--,--,--,--,--,--
Mahindra Manulife Mid Cap Fund - Direct Plan,27.31,6/32,30.77,8/25,--,--,--,--,--,--
Mahindra Manulife Multi Cap Fund - Direct Plan,24.58,5/14,28.23,--,--,--,--,--,--,--
Mahindra Manulife Small Cap Fund - Direct Plan,--,--,--,--,--,--,--,--,--,--
Mahindra Manulife Value Fund - Direct Plan,--,--,--,--,--,--,--,--,--,--
Mirae Asset Banking and Financial Services Fund - Direct Plan,21.44,6/17,--,--,--,--,--,--,--,--
Mirae Asset BSE 200 Equal Weight ETF,--,--,--,--,--,--,--,--,--,--
Mirae Asset BSE 200 Equal Weight ETF FoF - Direct Plan,--,--,--,--,--,--,--,--,--,--
Mirae Asset BSE Select IPO ETF,--,--,--,--,--,--,--,--,--,--
Mirae Asset BSE Select IPO ETF FoF - Direct Plan,--,--,--,--,--,--,--,--,--,--
Mirae Asset BSE Sensex ETF,--,--,--,--,--,--,--,--,--,--
Mirae Asset Diversified Equity Allocator Passive FoF - Direct Plan,17.55,35/78,--,--,--,--,--,--,--,--
Mirae Asset ELSS Tax Saver Fund - Direct Plan,19.50,17/33,23.56,12/33,--,--,--,--,--,--
Mirae Asset Flexi Cap Fund - Direct Plan,--,--,--,--,--,--,--,--,--,--
Mirae Asset Focused Fund - Direct Plan,14.16,63/68,19.22,43/54,--,--,--,--,--,--
Mirae Asset Global Electric & Autonomous Vehicles Equity Passive FoF - Direct Plan,--,--,--,--,--,--,--,--,--,--
Mirae Asset Global X Artificial Intelligence & Technology ETF FoF - Direct Plan,--,--,--,--,--,--,--,--,--,--
Mirae Asset Great Consumer Fund - Direct Plan,20.42,2/11,24.25,3/11,16.86,1/7,--,--,--,--
Mirae Asset Hang Seng TECH ETF,10.96,41/53,--,--,--,--,--,--,--,--
Mirae Asset Hang Seng TECH ETF FoF - Direct Plan,13.91,30/47,--,--,--,--,--,--,--,--
Mirae Asset Healthcare Fund - Direct Plan,25.62,7/11,23.60,5/9,--,--,--,--,--,--
